{
  "version": "v1",
  "note": "Codes and titles only. No descriptor or band-descriptor text is reproduced. Topic links are mapping judgements, not coverage certifications.",
  "sourceCount": 4,
  "itemCount": 109,
  "sources": [
    {
      "slug": "cefr-cv",
      "name": "Common European Framework of Reference for Languages: Companion Volume — illustrative descriptor scales",
      "publisher": "Council of Europe",
      "version": "2020",
      "url": "https://www.coe.int/en/web/common-european-framework-reference-languages",
      "idPolicy": "Scale names are official; codes are project-assigned slugs of those names. Topics cite scales and CEFR levels, never descriptor text.",
      "items": [
        {
          "key": "cefr-cv:rec.oral.overall",
          "code": "rec.oral.overall",
          "title": "Overall oral comprehension",
          "group": "Reception: oral comprehension"
        },
        {
          "key": "cefr-cv:rec.oral.conversation-between-others",
          "code": "rec.oral.conversation-between-others",
          "title": "Understanding conversation between other people",
          "group": "Reception: oral comprehension"
        },
        {
          "key": "cefr-cv:rec.oral.live-audience",
          "code": "rec.oral.live-audience",
          "title": "Understanding as a member of a live audience",
          "group": "Reception: oral comprehension"
        },
        {
          "key": "cefr-cv:rec.oral.announcements-instructions",
          "code": "rec.oral.announcements-instructions",
          "title": "Understanding announcements and instructions",
          "group": "Reception: oral comprehension"
        },
        {
          "key": "cefr-cv:rec.oral.media-recordings",
          "code": "rec.oral.media-recordings",
          "title": "Understanding audio (or signed) media and recordings",
          "group": "Reception: oral comprehension"
        },
        {
          "key": "cefr-cv:rec.av.film-video",
          "code": "rec.av.film-video",
          "title": "Watching TV, film and video",
          "group": "Reception: audio-visual comprehension"
        },
        {
          "key": "cefr-cv:rec.read.overall",
          "code": "rec.read.overall",
          "title": "Overall reading comprehension",
          "group": "Reception: reading comprehension"
        },
        {
          "key": "cefr-cv:rec.read.correspondence",
          "code": "rec.read.correspondence",
          "title": "Reading correspondence",
          "group": "Reception: reading comprehension"
        },
        {
          "key": "cefr-cv:rec.read.orientation",
          "code": "rec.read.orientation",
          "title": "Reading for orientation",
          "group": "Reception: reading comprehension"
        },
        {
          "key": "cefr-cv:rec.read.information-argument",
          "code": "rec.read.information-argument",
          "title": "Reading for information and argument",
          "group": "Reception: reading comprehension"
        },
        {
          "key": "cefr-cv:rec.read.instructions",
          "code": "rec.read.instructions",
          "title": "Reading instructions",
          "group": "Reception: reading comprehension"
        },
        {
          "key": "cefr-cv:rec.read.leisure",
          "code": "rec.read.leisure",
          "title": "Reading as a leisure activity",
          "group": "Reception: reading comprehension"
        },
        {
          "key": "cefr-cv:rec.strat.cues-inferring",
          "code": "rec.strat.cues-inferring",
          "title": "Identifying cues and inferring (spoken, signed and written)",
          "group": "Reception strategies"
        },
        {
          "key": "cefr-cv:prod.oral.overall",
          "code": "prod.oral.overall",
          "title": "Overall oral production",
          "group": "Production: oral production"
        },
        {
          "key": "cefr-cv:prod.oral.describing-experience",
          "code": "prod.oral.describing-experience",
          "title": "Sustained monologue: describing experience",
          "group": "Production: oral production"
        },
        {
          "key": "cefr-cv:prod.oral.giving-information",
          "code": "prod.oral.giving-information",
          "title": "Sustained monologue: giving information",
          "group": "Production: oral production"
        },
        {
          "key": "cefr-cv:prod.oral.putting-a-case",
          "code": "prod.oral.putting-a-case",
          "title": "Sustained monologue: putting a case (e.g. in a debate)",
          "group": "Production: oral production"
        },
        {
          "key": "cefr-cv:prod.oral.public-announcements",
          "code": "prod.oral.public-announcements",
          "title": "Public announcements",
          "group": "Production: oral production"
        },
        {
          "key": "cefr-cv:prod.oral.addressing-audiences",
          "code": "prod.oral.addressing-audiences",
          "title": "Addressing audiences",
          "group": "Production: oral production"
        },
        {
          "key": "cefr-cv:prod.writ.overall",
          "code": "prod.writ.overall",
          "title": "Overall written production",
          "group": "Production: written production"
        },
        {
          "key": "cefr-cv:prod.writ.creative",
          "code": "prod.writ.creative",
          "title": "Creative writing",
          "group": "Production: written production"
        },
        {
          "key": "cefr-cv:prod.writ.reports-essays",
          "code": "prod.writ.reports-essays",
          "title": "Reports and essays",
          "group": "Production: written production"
        },
        {
          "key": "cefr-cv:prod.strat.planning",
          "code": "prod.strat.planning",
          "title": "Planning",
          "group": "Production strategies"
        },
        {
          "key": "cefr-cv:prod.strat.compensating",
          "code": "prod.strat.compensating",
          "title": "Compensating",
          "group": "Production strategies"
        },
        {
          "key": "cefr-cv:prod.strat.monitoring-repair",
          "code": "prod.strat.monitoring-repair",
          "title": "Monitoring and repair",
          "group": "Production strategies"
        },
        {
          "key": "cefr-cv:int.oral.overall",
          "code": "int.oral.overall",
          "title": "Overall oral interaction",
          "group": "Interaction: oral interaction"
        },
        {
          "key": "cefr-cv:int.oral.understanding-interlocutor",
          "code": "int.oral.understanding-interlocutor",
          "title": "Understanding an interlocutor",
          "group": "Interaction: oral interaction"
        },
        {
          "key": "cefr-cv:int.oral.conversation",
          "code": "int.oral.conversation",
          "title": "Conversation",
          "group": "Interaction: oral interaction"
        },
        {
          "key": "cefr-cv:int.oral.informal-discussion",
          "code": "int.oral.informal-discussion",
          "title": "Informal discussion (with friends)",
          "group": "Interaction: oral interaction"
        },
        {
          "key": "cefr-cv:int.oral.formal-discussion",
          "code": "int.oral.formal-discussion",
          "title": "Formal discussion (meetings)",
          "group": "Interaction: oral interaction"
        },
        {
          "key": "cefr-cv:int.oral.goal-oriented-cooperation",
          "code": "int.oral.goal-oriented-cooperation",
          "title": "Goal-oriented co-operation",
          "group": "Interaction: oral interaction"
        },
        {
          "key": "cefr-cv:int.oral.information-exchange",
          "code": "int.oral.information-exchange",
          "title": "Information exchange",
          "group": "Interaction: oral interaction"
        },
        {
          "key": "cefr-cv:int.oral.interviewing",
          "code": "int.oral.interviewing",
          "title": "Interviewing and being interviewed",
          "group": "Interaction: oral interaction"
        },
        {
          "key": "cefr-cv:int.oral.telecommunications",
          "code": "int.oral.telecommunications",
          "title": "Using telecommunications",
          "group": "Interaction: oral interaction"
        },
        {
          "key": "cefr-cv:int.writ.overall",
          "code": "int.writ.overall",
          "title": "Overall written interaction",
          "group": "Interaction: written interaction"
        },
        {
          "key": "cefr-cv:int.writ.correspondence",
          "code": "int.writ.correspondence",
          "title": "Correspondence",
          "group": "Interaction: written interaction"
        },
        {
          "key": "cefr-cv:int.writ.notes-messages-forms",
          "code": "int.writ.notes-messages-forms",
          "title": "Notes, messages and forms",
          "group": "Interaction: written interaction"
        },
        {
          "key": "cefr-cv:int.online.conversation-discussion",
          "code": "int.online.conversation-discussion",
          "title": "Online conversation and discussion",
          "group": "Interaction: online interaction"
        },
        {
          "key": "cefr-cv:int.online.goal-oriented-collaboration",
          "code": "int.online.goal-oriented-collaboration",
          "title": "Goal-oriented online transactions and collaboration",
          "group": "Interaction: online interaction"
        },
        {
          "key": "cefr-cv:int.strat.turntaking",
          "code": "int.strat.turntaking",
          "title": "Turntaking",
          "group": "Interaction strategies"
        },
        {
          "key": "cefr-cv:int.strat.cooperating",
          "code": "int.strat.cooperating",
          "title": "Co-operating",
          "group": "Interaction strategies"
        },
        {
          "key": "cefr-cv:int.strat.asking-clarification",
          "code": "int.strat.asking-clarification",